{
  "schema_version": "infralink.release-candidate.v1",
  "release": {
    "identity": "releases/core-v2/42",
    "channel": "core-v2",
    "sequence": 42
  },
  "registry_commit": "aaaaaaaaaaaaaaaaaaaaaaaaaaaaaaaaaaaaaaaa",
  "controller_commit": "bbbbbbbbbbbbbbbbbbbbbbbbbbbbbbbbbbbbbbbb",
  "ci_receipt": {
    "provider": "woodpecker",
    "repository": "example/registry",
    "run": "576"
  },
  "artifacts": [
    {
      "path": "release/runtime.tar.gz",
      "sha256": "cccccccccccccccccccccccccccccccccccccccccccccccccccccccccccccccc"
    }
  ],
  "consumers": ["citadel", "watchtower"]
}
